{
  "$schema": "./schemas/extension-config.schema.json",
  "namespace": "crxkit",
  "minimumChromeVersion": "114",
  "defaultLocale": "en",
  "manifest": {
    "nameMessage": "extension_name",
    "descriptionMessage": "extension_description",
    "version": "0.1.2",
    "icons": {
      "16": "public/icon16.png",
      "32": "public/icon32.png",
      "48": "public/icon48.png",
      "128": "public/icon128.png"
    }
  },
  "permissions": ["storage", "activeTab", "tabs", "sidePanel"],
  "hostPermissions": ["<all_urls>"],
  "webAccessibleResources": ["public/*", "contentScript.css"],
  "sidePanel": {
    "autoOpenDefault": true,
    "allowedHosts": ["localhost", "zhanghe.dev"]
  },
  "settings": {
    "theme": "system",
    "pinnedHosts": [],
    "sidePanel": {
      "autoOpen": true
    }
  },
  "entries": {
    "popup": {
      "kind": "popup",
      "input": "src/entries/popup/main.tsx",
      "html": "src/entries/popup/index.html",
      "output": "popup.html"
    },
    "sidePanel": {
      "kind": "side-panel",
      "input": "src/entries/side-panel/main.tsx",
      "html": "src/entries/side-panel/index.html",
      "output": "sidePanel.html"
    },
    "options": {
      "kind": "options",
      "input": "src/entries/options/main.tsx",
      "html": "src/entries/options/index.html",
      "output": "options.html",
      "openInTab": true
    },
    "newTab": {
      "kind": "new-tab",
      "input": "src/entries/new-tab/main.tsx",
      "html": "src/entries/new-tab/index.html",
      "output": "newTab.html"
    },
    "background": {
      "kind": "background",
      "input": "src/entries/background/index.ts",
      "output": "background.js"
    },
    "contentScript": {
      "kind": "content",
      "input": "src/entries/content/index.ts",
      "output": "contentScript.js",
      "css": "contentScript.css",
      "matches": ["<all_urls>"],
      "runAt": "document_idle"
    }
  }
}
